asin;availability;promoOffer;vendor;productName;buyBoxSeller;buyBoxPrice;buyBoxShipping;brand;partNumber;itemModelNumber;asinDomin;rating;quantity;bSR;bSRCategory;dateFirstAvailable;isNew
B07D78TSFM;true;false;Ej-Home;Shower Filter for Hard Water - Removes Chlorine, Fluoride, Lead - Improves the Condition of Your Hair and Skin - Water Softener - for any Shower Head and Handheld - 2 Cartridges Included;EJ-home;25.47;& FREE shipping.;;;;B07D78TSFM;4.6;21;26711;Tools & Home Improvement ;Tue May 22 00:00:00 EEST 2018;OFFERS: [price='$25.47', shipingInfo='& FREE ShippingDetails', seller='EJ-home'] | [price='$25.47', shipingInfo='', seller='EJ-home'] | [price='& FREE ShippingDetails', shipingInfo='& FREE ShippingDetails', seller='EJ-home'];SHORT_INFO:
B01MXOG8RB;true;false;Zen Bidet;Zen Bidet Fuentes 300 Dual Function (Soft/Jet) Stainless Steel Hand Held Sprayer Shattaf Toilet Attachment | Complete Handheld Cloth Diaper Spray Set Extra Long Hose and T Adapter;Zen Bidet;38.94;& FREE shipping.;;F-300;Fuentes 300;B01MXOG8RB;4.6;157;15655;Tools & Home Improvement ;Mon Sep 26 00:00:00 EEST 2016;OFFERS: [price='$38.94', shipingInfo='& FREE ShippingDetails', seller='Zen Bidet'] | [price='$38.94', shipingInfo='', seller='Zen Bidet'] | [price='& FREE ShippingDetails', shipingInfo='& FREE ShippingDetails', seller='Zen Bidet'];SHORT_INFO: [asin='B01MXOG8RB', availability=true, firstOffer=[price='$38.94', shipingInfo='& FREE ShippingDetails', seller='Zen Bidet']] | [asin='B06WVGM45W', availability=true, firstOffer=[price='$19.74', shipingInfo='& FREE Shipping on orders over $25.00 shipped by Amazon. Details', seller='Zen Bidet']]
B005VPL5U8;true;false;Pro Products;Pro Products RO12N Rust Out Water Softener Cleaner And Iron Remover, 1.5 lb.;;6.95;& FREE shipping on orders over $25.00.;;;RO12N;B005VPL5U8;4.0;37;1593;Industrial & Scientific ;Tue Aug 07 05:12:15 EEST 2018;OFFERS: [price='$6.95', shipingInfo='& FREE Shipping on orders over $25.00 shipped by Amazon. Details', seller='Lighting Sales LLC Materro LLC ReliableMarketplace Wired Fox Technologies SIM Supply, Inc. Isopure_Water Next Day MRO Water Softeners Filters B2B Superstore'] | [price='$6.95', shipingInfo='', seller='Lighting Sales LLC Materro LLC ReliableMarketplace Wired Fox Technologies SIM Supply, Inc. Isopure_Water Next Day MRO Water Softeners Filters B2B Superstore'] | [price='& FREE Shipping on orders over $25.00 shipped by Amazon. Details', shipingInfo='& FREE Shipping on orders over $25.00 shipped by Amazon. Details', seller='Lighting Sales LLC Materro LLC ReliableMarketplace Wired Fox Technologies SIM Supply, Inc. Isopure_Water Next Day MRO Water Softeners Filters B2B Superstore'];SHORT_INFO: [asin='B00HVX4PSM', availability=true, firstOffer=[price='$9.95', shipingInfo='& FREE Shipping on orders over $25.00 shipped by Amazon. Details', seller='DiscountFilterStore Lighting Sales LLC Next Day MRO Materro LLC Water Softeners Filters Healthybowls Ton of Stuff']] | [asin='B005VPL5U8', availability=true, firstOffer=[price='$6.95', shipingInfo='& FREE Shipping on orders over $25.00 shipped by Amazon. Details', seller='Lighting Sales LLC Materro LLC ReliableMarketplace Wired Fox Technologies SIM Supply, Inc. Isopure_Water Next Day MRO Water Softeners Filters B2B Superstore']]
B07BNXRLZ1;false;false;Vaunn;Vaunn Medical Bathroom Adjustable Toilet Rail Grab Bar and Commode Safety Frame Handle;Beyond Med Shop;46.99;;;;; B07BNXRLZ1;4.4;82;25538;Health & Household ;Tue Aug 07 05:12:15 EEST 2018;OFFERS:;SHORT_INFO:
B07787L89H;true;false;ESOW;ESOW Kitchen Water Filter Faucet, 100% Lead-Free Drinking Water Faucet Fits most RO Units or Water Filtration System, Stainless Steel Body Brushed Nickel, Sink Water Filtration Faucet, 1/4-Inch Tube;ESOW;32.68;& FREE shipping.;;43239-95036;;B07787L89H;4.4;40;22588;Tools & Home Improvement ;Tue Nov 07 00:00:00 EET 2017;OFFERS: [price='$32.68', shipingInfo='& FREE ShippingDetails', seller='ESOW'] | [price='$32.68', shipingInfo='', seller='ESOW'] | [price='& FREE ShippingDetails', shipingInfo='& FREE ShippingDetails', seller='ESOW'];SHORT_INFO: [asin='B07787L89H', availability=true, firstOffer=[price='$32.68', shipingInfo='& FREE ShippingDetails', seller='ESOW']]
B07D5Q7FXK;true;false;Yuan She;Yuan She Self Adhesive Wall Hooks Damage Free Strong Plastic Hanger 6-Hooks for Towel in Bathroom Grey;Yuan She;7.8;& FREE shipping on orders over $25.00 shipped by Amazon.;;;;B07D5Q7FXK;3.0;2;113771;Home & Kitchen ;Tue Aug 07 05:12:15 EEST 2018;OFFERS: [price='$7.80', shipingInfo='& FREE Shipping on orders over $25.00 shipped by Amazon. Details', seller='Yuan She'] | [price='$7.80', shipingInfo='', seller='Yuan She'] | [price='& FREE Shipping on orders over $25.00 shipped by Amazon. Details', shipingInfo='& FREE Shipping on orders over $25.00 shipped by Amazon. Details', seller='Yuan She'];SHORT_INFO:
B074N5C71B;true;false;Aqua Elegante;6 Function Handheld Shower Head Kit - High Pressure, Removable Hand Held Showerhead With Hose & Mount And Adjustable Rainfall Spray - Oil-Rubbed Bronze;Aqua Elegante;53.95;& FREE shipping.;;Handheld Shower Kit - Oil-Rubbed Bronze;;B074N5C71B;4.6;462;10408;Tools & Home Improvement ;Tue Aug 01 00:00:00 EEST 2017;OFFERS: [price='$53.95', shipingInfo='& FREE ShippingDetails', seller='Aqua Elegante'] | [price='$53.95', shipingInfo='', seller='Aqua Elegante'] | [price='& FREE ShippingDetails', shipingInfo='& FREE ShippingDetails', seller='Aqua Elegante'];SHORT_INFO: [asin='B0755DNW63', availability=true, firstOffer=[price='$54.95', shipingInfo='& FREE ShippingDetails', seller='Aqua Elegante']] | [asin='B074N5C71B', availability=true, firstOffer=[price='$53.95', shipingInfo='& FREE ShippingDetails', seller='Aqua Elegante']] | [asin='B0755J7LWT', availability=true, firstOffer=[price='$44.95', shipingInfo='& FREE ShippingDetails', seller='Aqua Elegante']]
B01H2DG1YG;true;false;AquaDance;AquaDance 7" Premium High Pressure 3-way Rainfall Shower Combo for the Best of Both Worlds - Enjoy Luxurious 6-setting Rain Showerhead and 6-setting Hand Held Shower Separately or Together!-3328;NovaHome;39.99;& FREE shipping.;;3328;3328;B01H2DG1YG;4.4;2,726;236;Tools & Home Improvement ;Thu Jun 30 00:00:00 EEST 2016;OFFERS: [price='$39.99', shipingInfo='& FREE ShippingDetails', seller='NovaHome NovaHome'] | [price='$39.99', shipingInfo='', seller='NovaHome NovaHome'] | [price='& FREE ShippingDetails', shipingInfo='& FREE ShippingDetails', seller='NovaHome NovaHome'];SHORT_INFO: [asin='B01H2DG1YG', availability=true, firstOffer=[price='$39.99', shipingInfo='& FREE ShippingDetails', seller='NovaHome NovaHome']]
B01N2I8V0H;true;false;Woooow;Modern 304 Stainless Steel Single Prong Round Robe Hook, Wall Robe Hook Brushed Nickel;Woooow;12.88;& FREE shipping on orders over $25.00 shipped by Amazon.;;;COMIN18JU068505;B01N2I8V0H;4.5;46;24466;Tools & Home Improvement ;Tue Aug 07 05:12:15 EEST 2018;OFFERS: [price='$12.88', shipingInfo='& FREE Shipping on orders over $25.00 shipped by Amazon. Details', seller='Woooow'] | [price='$12.88', shipingInfo='', seller='Woooow'] | [price='& FREE Shipping on orders over $25.00 shipped by Amazon. Details', shipingInfo='& FREE Shipping on orders over $25.00 shipped by Amazon. Details', seller='Woooow'];SHORT_INFO: [asin='B01N2I8V0H', availability=true, firstOffer=[price='$12.88', shipingInfo='& FREE Shipping on orders over $25.00 shipped by Amazon. Details', seller='Woooow']]
B01FGYVUTE;true;false;FLYMEI;FLYMEI [Upgraded Version] 20 LED Lighted Makeup Mirror, Vanity Mirror with Touch Screen, Detachable 10X Magnification Spot Mirror, Countertop Cosmetic Mirror, Include AA Batteries, Black;FLYMEI;14.99;& FREE shipping on orders over $25.00 shipped by Amazon.;;;SYNCHKG097552;B01FGYVUTE;3.8;929;28815;Home & Kitchen ;Tue Aug 07 05:12:15 EEST 2018;OFFERS: [price='$14.99', shipingInfo='& FREE Shipping on orders over $25.00 shipped by Amazon. Details', seller='FLYMEI'] | [price='$14.99', shipingInfo='', seller='FLYMEI'] | [price='& FREE Shipping on orders over $25.00 shipped by Amazon. Details', shipingInfo='& FREE Shipping on orders over $25.00 shipped by Amazon. Details', seller='FLYMEI'];SHORT_INFO: [asin='B01FGYVUTE', availability=true, firstOffer=[price='$14.99', shipingInfo='& FREE Shipping on orders over $25.00 shipped by Amazon. Details', seller='FLYMEI']]
B00CZ3OU6A;true;false;InSinkErator;InSinkErator H-CONTOUR-SS Invite Contour Instant Hot Water Dispenser System with Stainless Steel Tank, Chrome;;203.99;& FREE shipping.;;H-CONTOUR-SS;H-CONTOUR-SS;B00CZ3OU6A;4.3;219;14383;Tools & Home Improvement ;Mon Apr 29 00:00:00 EEST 2013;OFFERS:;SHORT_INFO: [asin='B01LR7AJOQ', availability=true, firstOffer=null] | [asin='B00CZ3OU6A', availability=true, firstOffer=null]
B00S15SJTK;true;false;Comfify;Comfify Fleur De Lis Cast Iron Toilet Paper Roll holder - Cast Iron Wall Mounted Toilet Tissue Holder - European Vintage Design - 6.75" x 6.25" x 4.25” - With Screws And Anchors by (Antique White);HOME & KITCHEN USA;14.99;& FREE shipping on orders over $25.00 shipped by Amazon.;;;CM201553-white;B00S15SJTK;3.8;250;32024;Home & Kitchen ;Tue Aug 07 05:12:15 EEST 2018;OFFERS: [price='$14.99', shipingInfo='& FREE Shipping on orders over $25.00 shipped by Amazon. Details', seller='HOME & KITCHEN USA'] | [price='$14.99', shipingInfo='', seller='HOME & KITCHEN USA'] | [price='& FREE Shipping on orders over $25.00 shipped by Amazon. Details', shipingInfo='& FREE Shipping on orders over $25.00 shipped by Amazon. Details', seller='HOME & KITCHEN USA'];SHORT_INFO: [asin='B00S15SJTK', availability=true, firstOffer=[price='$14.99', shipingInfo='& FREE Shipping on orders over $25.00 shipped by Amazon. Details', seller='HOME & KITCHEN USA']]
B076F3921F;true;false;HOTIS HOME;Hotis Modern High Arc 1 or 3 Hole Single Handle Stainless Steel Prep Sprayer Pull Out Pull Down Sprayer Kitchen Sink Faucet,Brushed Nickel with Deck Plate;Hotis home;63.99;& FREE shipping.;;HT-QQT048L-D-new-1;;B076F3921F;4.3;33;16465;Tools & Home Improvement ;Fri Feb 02 00:00:00 EET 2018;OFFERS: [price='$63.99', shipingInfo='& FREE ShippingDetails', seller='Hotis home'] | [price='$63.99', shipingInfo='', seller='Hotis home'] | [price='& FREE ShippingDetails', shipingInfo='& FREE ShippingDetails', seller='Hotis home'];SHORT_INFO: [asin='B076F3921F', availability=true, firstOffer=[price='$63.99', shipingInfo='& FREE ShippingDetails', seller='Hotis home']]
B07DPMYBBN;true;false;Jayol;LED Vanity Mirror Light, Jayol Dimmable Makeup Light with 1.8m USB Cable, Super Bright LED Mirror Light, 360 Degree Rotation Vanity Light Kits, Cosmetic Lamp for Bathroom Dressing Room Vanity Table;Jayol;16.99;& FREE shipping on orders over $25.00 shipped by Amazon.;;;;B07DPMYBBN;4.8;16;20033;Tools & Home Improvement ;Wed Jun 13 00:00:00 EEST 2018;OFFERS: [price='$16.99', shipingInfo='& FREE Shipping on orders over $25.00 shipped by Amazon. Details', seller='Jayol'] | [price='$16.99', shipingInfo='', seller='Jayol'] | [price='& FREE Shipping on orders over $25.00 shipped by Amazon. Details', shipingInfo='& FREE Shipping on orders over $25.00 shipped by Amazon. Details', seller='Jayol'];SHORT_INFO:
B000XW0ORY;true;false;Moen;Moen DN6703BN Danbury Double Robe Hook, Brushed Nickel;;9.99;& FREE shipping on orders over $25.00.;;DN6703BN;DN6703BN;B000XW0ORY;4.6;228;16818;Tools & Home Improvement ;Tue May 15 00:00:00 EEST 2007;OFFERS: [price='$9.99', shipingInfo='& FREE Shipping on orders over $25.00 shipped by Amazon. Details', seller='Dearpete22 Dearpete22 Posey Supply Co., Inc. AF Supply Bath1 Buy Plumbing BUDORA DIRECT FAUCETS AND ACCESSORIES PlumberStock'] | [price='$9.99', shipingInfo='', seller='Dearpete22 Dearpete22 Posey Supply Co., Inc. AF Supply Bath1 Buy Plumbing BUDORA DIRECT FAUCETS AND ACCESSORIES PlumberStock'] | [price='& FREE Shipping on orders over $25.00 shipped by Amazon. Details', shipingInfo='& FREE Shipping on orders over $25.00 shipped by Amazon. Details', seller='Dearpete22 Dearpete22 Posey Supply Co., Inc. AF Supply Bath1 Buy Plumbing BUDORA DIRECT FAUCETS AND ACCESSORIES PlumberStock'];SHORT_INFO: [asin='B000XW0ORY', availability=true, firstOffer=[price='$9.99', shipingInfo='& FREE Shipping on orders over $25.00 shipped by Amazon. Details', seller='Dearpete22 Dearpete22 Posey Supply Co., Inc. AF Supply Bath1 Buy Plumbing BUDORA DIRECT FAUCETS AND ACCESSORIES PlumberStock']]
B079KQ2FJC;true;false;FChome;FChome Shower Wall Suction Cup Grab Bars,12 Inches Shower Handle Bar Offers Safe Grip with Strong Hold Suction Cup for Safety Grip Grab in Bathroom (White-Gray);ShenZhen City YiHaoKangGuang Electric Co., LTD;8.68;& FREE shipping.;;43237-2;4336306098;B079KQ2FJC;0.0;0;28395;Tools & Home Improvement ;Sat Feb 03 00:00:00 EET 2018;OFFERS: [price='$8.59', shipingInfo='& FREE Shipping', seller='Miluss ShenZhen City YiHaoKangGuang Electric Co., LTD'] | [price='& FREE Shipping', shipingInfo='& FREE Shipping', seller='Miluss ShenZhen City YiHaoKangGuang Electric Co., LTD'];SHORT_INFO: [asin='B079KQ2FJC', availability=true, firstOffer=[price='$8.59', shipingInfo='& FREE Shipping', seller='Miluss ShenZhen City YiHaoKangGuang Electric Co., LTD']]
B000BQSY9M;true;false;Prime-Line Products;Prime-Line 1932 Shower Door Catch, Nylon Tip, Stainless Steel;;4.59;& FREE shipping.;;1932;1932;B000BQSY9M;3.6;116;22740;Tools & Home Improvement ;Wed Oct 12 00:00:00 EEST 2005;OFFERS: [price='$4.54', shipingInfo='& FREE Shipping', seller='THE BT GROUP Junipers'  MaxWarehouse Great Household Pro Hardware Independence Fulfillment Services Sirr0und Home and Hardware Supply SIM Supply, Inc.'] | [price='& FREE Shipping', shipingInfo='& FREE Shipping', seller='THE BT GROUP Junipers'  MaxWarehouse Great Household Pro Hardware Independence Fulfillment Services Sirr0und Home and Hardware Supply SIM Supply, Inc.'];SHORT_INFO: [asin='B00FFYYPUM', availability=true, firstOffer=[price='$19.00', shipingInfo='& FREE Shipping on orders over $25.00 shipped by Amazon. Details', seller='ReliableMarketplace BidTrade L.L.C.']] | [asin='B00ENYG7RY', availability=true, firstOffer=[price='$45.84', shipingInfo='& FREE ShippingDetails', seller='Amazon.com']] | [asin='B00ENYG6H0', availability=true, firstOffer=[price='$10.76', shipingInfo='& FREE Shipping on orders over $25.00 shipped by Amazon. Details', seller='Amazon.com']]
B07CRLKX31;false;false;IKproductpro;Makeup Mirror - Vanity Mirror - Cosmetic LED Mirror for women - LED Mirror for beautiful you;LIK Group;27.99;;;;; B07CRLKX31;5.0;7;20148;Beauty & Personal Care ;Tue Aug 07 05:12:15 EEST 2018;OFFERS:;SHORT_INFO:
B077XK8B1W;false;false;uComforts;uComforts Hollywood Style LED Vanity Mirror Lights Kit for Makeup, Lighting Fixture Strip, Dimmable Bulbs, Makeup Vanity Light Set, Dressing Room Makeup Mirror Light, 10 Bulbs;;0.0;;;;;B077XK8B1W;4.5;16;8047;Tools & Home Improvement ;Mon Dec 04 00:00:00 EET 2017;OFFERS:;SHORT_INFO:
B01ENWJBLO;true;false;Hardware House;Harki|#Hardware House LLC 222907 Hardware House 22-2907 Santa Rosa Paper Holder, Oil Rubbed Bronze,;;11.88; $4.99 shipping;;222907;222907;B01ENWJBLO;4.5;6;39787;Tools & Home Improvement ;Fri Apr 22 00:00:00 EEST 2016;OFFERS: [price='$6.88', shipingInfo='+ $4.99shipping', seller='Michele'sBooks  SaveMyRemote Choice Direct Hardware World'] | [price='+ $4.99shipping', shipingInfo='+ $4.99shipping', seller='Michele'sBooks  SaveMyRemote Choice Direct Hardware World'] | [price='+ $4.99shipping', shipingInfo='shipping', seller='Michele'sBooks  SaveMyRemote Choice Direct Hardware World'];SHORT_INFO: [asin='B01ENWJBLO', availability=true, firstOffer=[price='$6.88', shipingInfo='+ $4.99shipping', seller='Michele'sBooks  SaveMyRemote Choice Direct Hardware World']] | [asin='B01MR897RC', availability=true, firstOffer=null] | [asin='B079828YF3', availability=true, firstOffer=[price='$15.39', shipingInfo='& FREE Shipping on orders over $25.00 shipped by Amazon. Details', seller='Johnson Misc.']]
B000FSQOXE;true;false;LASCO;LASCO 14-1039 White Plastic Toilet Seat Hinge with Bolts and Nuts, Top Tightening, Fits Bemis Brand;;6.99;& FREE shipping on orders over $25.00.;;;14-1039;B000FSQOXE;3.8;96;12113;Tools & Home Improvement ;Tue Aug 07 05:12:15 EEST 2018;OFFERS:;SHORT_INFO: [asin='B000FSQOXE', availability=true, firstOffer=null] | [asin='B07DK9MMY2', availability=true, firstOffer=[price='$403.35', shipingInfo='& FREE ShippingDetails', seller='Amazon.com']]
B000BQS4HE;true;false;Culligan;Culligan D-250A Cartridge Set;;36.55;& FREE shipping.;;;D250A;B000BQS4HE;4.1;183;6930;Tools & Home Improvement ;Wed Aug 17 00:00:00 EEST 2005;OFFERS: [price='$36.55', shipingInfo='& FREE ShippingDetails', seller='WaterFiltersOnline LLC (Same Day Shipping) MaxWarehouse Life and Home toolboxsupply Great Household Great Brands USA Gatzies Appliance Cove DiscountFilterStore'] | [price='$36.55', shipingInfo='', seller='WaterFiltersOnline LLC (Same Day Shipping) MaxWarehouse Life and Home toolboxsupply Great Household Great Brands USA Gatzies Appliance Cove DiscountFilterStore'] | [price='& FREE ShippingDetails', shipingInfo='& FREE ShippingDetails', seller='WaterFiltersOnline LLC (Same Day Shipping) MaxWarehouse Life and Home toolboxsupply Great Household Great Brands USA Gatzies Appliance Cove DiscountFilterStore'];SHORT_INFO: [asin='B01MU1VE4A', availability=true, firstOffer=[price='$62.31', shipingInfo='+ $3.99shipping', seller='Nakoop Books Books Land Nathan bookstore American Shopping Palm Great Jaspee City Mandy777 EB STORE Book Pot']] | [asin='B005N27724', availability=true, firstOffer=[price='$34.99', shipingInfo='+ $5.49shipping', seller='doubledecker MaxWarehouse toolboxsupply Southfork Homecenter Gatzies SIM Supply, Inc. Home and Hardware Supply Water Softeners Filters PLEXSUPPLY Rippleton Tools']] | [asin='B00448NCBS', availability=true, firstOffer=[price='$205.62', shipingInfo='& FREE Shipping', seller='Gatzies PLEXSUPPLY']]
B01HD4DFDE;true;false;Everflow;Everflow 75131 Kitchen Sink Basket Strainer Replacement for Kohler Style Drains Stainless Steel - With Spring Steel Stopper;Pro Plumbing Supply;9.99;& FREE shipping on orders over $25.00.;;75131;75131;B01HD4DFDE;4.3;108;10770;Tools & Home Improvement ;Tue Jun 21 00:00:00 EEST 2016;OFFERS: [price='$9.99', shipingInfo='& FREE Shipping on orders over $25.00 shipped by Amazon. Details', seller='Pro Plumbing Supply Pro Plumbing Supply'] | [price='$9.99', shipingInfo='', seller='Pro Plumbing Supply Pro Plumbing Supply'] | [price='& FREE Shipping on orders over $25.00 shipped by Amazon. Details', shipingInfo='& FREE Shipping on orders over $25.00 shipped by Amazon. Details', seller='Pro Plumbing Supply Pro Plumbing Supply'];SHORT_INFO: [asin='B01HD4DFDE', availability=true, firstOffer=[price='$9.99', shipingInfo='& FREE Shipping on orders over $25.00 shipped by Amazon. Details', seller='Pro Plumbing Supply Pro Plumbing Supply']]
B076XTPTBM;true;false;FS-TFC;FS-TFC Reverse Osmosis Water Filtration System 5-Stage 100 GPD Plus Extra Set of 4 Replacement Filter (FS-RO-100G-A);FS-TFC Water Systems;109.99;& FREE shipping.;;;FS-RO-100G-Water Filter;B076XTPTBM;0.0;0;30028;Tools & Home Improvement ;Tue Aug 07 05:12:15 EEST 2018;OFFERS:;SHORT_INFO: [asin='B076XTPTBM', availability=true, firstOffer=null] | [asin='B06X914LCN', availability=true, firstOffer=[price='$23.99', shipingInfo='& FREE Shipping on orders over $25.00 shipped by Amazon. Details', seller='FS-TFC Water Systems FS-TFC Water Systems']] | [asin='B07CYG7R2F', availability=true, firstOffer=[price='$64.99', shipingInfo='& FREE ShippingDetails', seller='FS-TFC Water Systems']]
B00B1EDXG2;true;false;Niagara Conservation;0.5 GPM Low Flow Dual-Thread Faucet Aerator - Kitchen and Bath - 6-PACK;Body-n-Home;9.08; $4.99 shipping;;N3205;N3205;B00B1EDXG2;4.4;345;15433;Tools & Home Improvement ;Tue Jan 15 00:00:00 EET 2013;OFFERS:;SHORT_INFO: [asin='B00B1EDXG2', availability=true, firstOffer=null]
B00C0YIJA2;true;false;Brita;Brita On Tap Faucet Water Filter System, Includes:1 System+2 Filters;Raypaula Products;66.99;& FREE shipping.;;8273810;COMINHKR063772;B00C0YIJA2;4.0;119;46299;Tools & Home Improvement ;Mon Mar 25 00:00:00 EET 2013;OFFERS:;SHORT_INFO: [asin='B00C0YIJA2', availability=true, firstOffer=null]
B075ZDWVP9;true;false;iSpring;iSpring WSP-50SL - Reusable Spin Down Sediment Water Filter/w Siliphos, Alternative Water Descaler or Softener, Hot Water System Protector - Multiple Micron sizes, 20 GPM, 1" MNPT + 3/4" FNPT;iSpring Water Systems;64.99;& FREE shipping.;;WSP-50SL;;B075ZDWVP9;5.0;33;8040;Tools & Home Improvement ;Wed Sep 27 00:00:00 EEST 2017;OFFERS: [price='$64.99', shipingInfo='& FREE ShippingDetails', seller='iSpring Water Systems iSpring Water Systems Pi Peak'] | [price='$64.99', shipingInfo='', seller='iSpring Water Systems iSpring Water Systems Pi Peak'] | [price='& FREE ShippingDetails', shipingInfo='& FREE ShippingDetails', seller='iSpring Water Systems iSpring Water Systems Pi Peak'];SHORT_INFO: [asin='B075ZDWVP9', availability=true, firstOffer=[price='$64.99', shipingInfo='& FREE ShippingDetails', seller='iSpring Water Systems iSpring Water Systems Pi Peak']] | [asin='B077YV5X3G', availability=true, firstOffer=[price='$19.99', shipingInfo='& FREE Shipping', seller='iSpring Water Systems']]
B00VJA7SIW;true;false;Niagara Conservation;NIAGARA CONSERVATION N2216-RK1 Niagara Handle Repair Kit;Home Repair Parts Store;6.87;& FREE shipping.;;N2216-RK1;N2216-RK1;B00VJA7SIW;4.6;34;34295;Tools & Home Improvement ;Wed Jun 01 00:00:00 EEST 2016;OFFERS:;SHORT_INFO: [asin='B00VJA7SIW', availability=true, firstOffer=null] | [asin='B005E0NEE0', availability=true, firstOffer=[price='$7.95', shipingInfo='& FREE Shipping on orders over $25.00 shipped by Amazon. Details', seller='Lunar Vendors Home Repair Parts Store BooksFORLife']]
B004K39DZQ;true;false;Watts Premier;Watts Premier 560014 Membrane 110009 24 GPD Membrane Replaced by 560014, 1-Pack;Isopure_Water;29.01; $4.99 shipping;;560014;560014;B004K39DZQ;4.3;290;13330;Tools & Home Improvement ;Fri May 29 00:00:00 EEST 2009;OFFERS: [price='$28.40', shipingInfo='+ $4.99shipping', seller='Brilliant_Treasures  Isopure_Water MaxWarehouse AmericanWaterSolutions Gatzies Home and Hardware Supply Life and Home UnbeatableSale, Inc Factory Hardware Store'] | [price='+ $4.99shipping', shipingInfo='+ $4.99shipping', seller='Brilliant_Treasures  Isopure_Water MaxWarehouse AmericanWaterSolutions Gatzies Home and Hardware Supply Life and Home UnbeatableSale, Inc Factory Hardware Store'] | [price='+ $4.99shipping', shipingInfo='shipping', seller='Brilliant_Treasures  Isopure_Water MaxWarehouse AmericanWaterSolutions Gatzies Home and Hardware Supply Life and Home UnbeatableSale, Inc Factory Hardware Store'];SHORT_INFO: [asin='B004K39DZQ', availability=true, firstOffer=[price='$28.40', shipingInfo='+ $4.99shipping', seller='Brilliant_Treasures  Isopure_Water MaxWarehouse AmericanWaterSolutions Gatzies Home and Hardware Supply Life and Home UnbeatableSale, Inc Factory Hardware Store']] | [asin='B0091OBMY4', availability=true, firstOffer=null] | [asin='B000JPYRTG', availability=true, firstOffer=[price='$345.95', shipingInfo='& FREE Shipping', seller='Premier H2O  Supply Cart Tempus & Co. Pirozhki ReliableMarketplace']]
B01F4DSYDM;true;false;Dysmio Lighting;Four Light Vanity Strip, Polished Chrome, 24-Inch, (2 Pack);BulbsNLighting;35.65;& FREE shipping.;;;DL-88820-4;B01F4DSYDM;4.2;157;16491;Tools & Home Improvement ;Tue May 03 00:00:00 EEST 2016;OFFERS: [price='$35.65', shipingInfo='& FREE ShippingDetails', seller='BulbsNLighting LiteMite SupremeLightingNYC LightOlight LiteMite Lighting Supply Group'] | [price='$35.65', shipingInfo='', seller='BulbsNLighting LiteMite SupremeLightingNYC LightOlight LiteMite Lighting Supply Group'] | [price='& FREE ShippingDetails', shipingInfo='& FREE ShippingDetails', seller='BulbsNLighting LiteMite SupremeLightingNYC LightOlight LiteMite Lighting Supply Group'];SHORT_INFO: [asin='B01F4DSYDM', availability=true, firstOffer=[price='$35.65', shipingInfo='& FREE ShippingDetails', seller='BulbsNLighting LiteMite SupremeLightingNYC LightOlight LiteMite Lighting Supply Group']]
B01MYMSDAI;true;false;AquaDance;AquaDance High Pressure 6-Setting 4.15" Chrome Face Hand Held Shower Head with Hose for Ultimate Shower Experience! Officially Independently Tested to Meet Strict US Quality & Performance Standards;NovaHome;23.59;& FREE shipping on orders over $25.00.;;3314;3314;B01MYMSDAI;4.5;476;26932;Tools & Home Improvement ;Sun Nov 20 00:00:00 EET 2016;OFFERS: [price='$23.59', shipingInfo='& FREE Shipping on orders over $25.00 shipped by Amazon. Details', seller='NovaHome NovaHome'] | [price='$23.59', shipingInfo='', seller='NovaHome NovaHome'] | [price='& FREE Shipping on orders over $25.00 shipped by Amazon. Details', shipingInfo='& FREE Shipping on orders over $25.00 shipped by Amazon. Details', seller='NovaHome NovaHome'];SHORT_INFO: [asin='B01MYMSDAI', availability=true, firstOffer=[price='$23.59', shipingInfo='& FREE Shipping on orders over $25.00 shipped by Amazon. Details', seller='NovaHome NovaHome']]
B06XKFB951;true;false;Wassern;Wassern Handheld Shower Head, High Pressure Rainfull Massage Spa Flexible 60'' Stainless Steel Hose Angle Adjustable Bracket 4setting 3'' Chrome;WASSERN KITCHEN&BATH;14.99;& FREE shipping on orders over $25.00.;;43224-2147;;B06XKFB951;4.3;123;12746;Tools & Home Improvement ;Sun Mar 12 00:00:00 EET 2017;OFFERS: [price='$14.99', shipingInfo='& FREE Shipping on orders over $25.00 shipped by Amazon. Details', seller='WASSERN KITCHEN&BATH BestStore+'] | [price='$14.99', shipingInfo='', seller='WASSERN KITCHEN&BATH BestStore+'] | [price='& FREE Shipping on orders over $25.00 shipped by Amazon. Details', shipingInfo='& FREE Shipping on orders over $25.00 shipped by Amazon. Details', seller='WASSERN KITCHEN&BATH BestStore+'];SHORT_INFO: [asin='B06XKFB951', availability=true, firstOffer=[price='$14.99', shipingInfo='& FREE Shipping on orders over $25.00 shipped by Amazon. Details', seller='WASSERN KITCHEN&BATH BestStore+']]
