asin;availability;promoOffer;vendor;productName;buyBoxSeller;buyBoxPrice;buyBoxShipping;brand;partNumber;itemModelNumber;asinDomin;rating;quantity;bSR;bSRCategory;dateFirstAvailable;isNew
B00BA9DE94;true;false;Omnipure;Omnipure K2533JJ Inline Water Filter with Quick-Connect;;18.98;& FREE shipping on orders over $25.00.;;K2533JJ;K2533JJ;B00BA9DE94;4.0;244;20992;Tools & Home Improvement ;Fri Mar 02 00:00:00 EET 2007;OFFERS:;SHORT_INFO: [asin='B00BA9DE94', availability=true, firstOffer=null] | [asin='B07B3X7DWK', availability=true, firstOffer=[price='$32.51', shipingInfo='+ $4.49shipping', seller='h2o4u KlayDirect']] | [asin='B0731R5PYY', availability=true, firstOffer=[price='$34.99', shipingInfo='+ $5.99shipping', seller='Isopure_Water']]
B01016EL5C;true;false;mDesign;mDesign Decorative Kitchen Over Cabinet Towel Bar - Hang on Inside or Outside of Doors, Storage and Display Rack for Hand, Dish, and Tea Towels - 9" Wide, Strong Steel Design in Bronze Finish;MetroDecor;8.99;& FREE shipping on orders over $25.00 shipped by Amazon.;;;CECOMINOD034269;B01016EL5C;4.3;245;14555;Tools & Home Improvement ;Wed Jun 17 00:00:00 EEST 2015;OFFERS: [price='$8.99', shipingInfo='& FREE Shipping on orders over $25.00 shipped by Amazon. Details', seller='MetroDecor'] | [price='$8.99', shipingInfo='', seller='MetroDecor'] | [price='& FREE Shipping on orders over $25.00 shipped by Amazon. Details', shipingInfo='& FREE Shipping on orders over $25.00 shipped by Amazon. Details', seller='MetroDecor'];SHORT_INFO: [asin='B01016EL5C', availability=true, firstOffer=[price='$8.99', shipingInfo='& FREE Shipping on orders over $25.00 shipped by Amazon. Details', seller='MetroDecor']]
B0009J1FLK;true;false;Le Creuset;Le Creuset Enameled Cast-Iron 2-Quart Round French Oven, Kiwi;;349.53; $7.42 shipping;;;L2501-1871;B0009J1FLK;4.5;4;1032002;Kitchen & Dining ;Tue Oct 02 00:00:00 EEST 2001;OFFERS: [price='$349.53', shipingInfo='+ $7.42shipping', seller='world bridge from Japan chacha JAPAN'] | [price='+ $7.42shipping', shipingInfo='+ $7.42shipping', seller='world bridge from Japan chacha JAPAN'] | [price='+ $7.42shipping', shipingInfo='shipping', seller='world bridge from Japan chacha JAPAN'];SHORT_INFO: [asin='B0009J1FLK', availability=true, firstOffer=[price='$349.53', shipingInfo='+ $7.42shipping', seller='world bridge from Japan chacha JAPAN']]
B014WH3AT4;true;false;Aroma Housewares;Aroma Doveware Stew Pot, 3.5 quart, Midnight Black (ADC-102B);;129.99;& FREE shipping.;;;ADC-102B;B014WH04MU;3.3;4;707248;Kitchen & Dining ;Fri Sep 04 00:00:00 EEST 2015;OFFERS:;SHORT_INFO: [asin='B014WH04MU', availability=true, firstOffer=[price='$129.99', shipingInfo='& FREE Shipping', seller='AROMA Housewares']]
B004KKXAMG;true;false;InterDesign;InterDesign Orbinni Spiral Free Standing Toilet Paper Holder – Spare Roll Storage for Bathroom, Chrome;;17.83;& FREE shipping on orders over $25.00.;;;68600EU;B004KKXAMG;4.4;88;61383;Home & Kitchen ;Tue Aug 07 05:12:13 EEST 2018;OFFERS: [price='$17.83', shipingInfo='& FREE Shipping on orders over $25.00 shipped by Amazon. Details', seller='Hartville Hardware Kest Enterprises LLC Organization-Store'] | [price='$17.83', shipingInfo='', seller='Hartville Hardware Kest Enterprises LLC Organization-Store'] | [price='& FREE Shipping on orders over $25.00 shipped by Amazon. Details', shipingInfo='& FREE Shipping on orders over $25.00 shipped by Amazon. Details', seller='Hartville Hardware Kest Enterprises LLC Organization-Store'];SHORT_INFO: [asin='B004KKXAMG', availability=true, firstOffer=[price='$17.83', shipingInfo='& FREE Shipping on orders over $25.00 shipped by Amazon. Details', seller='Hartville Hardware Kest Enterprises LLC Organization-Store']]
B00ENFSHCQ;true;false;Better Chef;Better Chef 3-Quart Heavy-Gauge Aluminum Dutch Oven with Glass Lid;CE Showroom;27.37;& FREE shipping.;;;D301S;B00ENFSHCQ;1.0;1;1092765;Kitchen & Dining ;Mon Aug 19 00:00:00 EEST 2013;OFFERS:;SHORT_INFO: [asin='B017Z9YGGM', availability=true, firstOffer=[price='$41.98', shipingInfo='+ $6.49shipping', seller='kentshop Mandy777 JB World Books']] | [asin='B00ENFSHCQ', availability=true, firstOffer=null]
B0013E9OJK;true;false;KitchenAid;Kitchen Aid (84211643) KCDB250G 1/2 HP Continuous Feed Garbage Disposal;Part Doctors;97.99;& FREE shipping.;;84211643;84211643;B0013E9OJK;4.6;296;14384;Tools & Home Improvement ;Thu Oct 25 00:00:00 EEST 2007;OFFERS: [price='$97.99', shipingInfo='& FREE Shipping', seller='Part Doctors Appliance Cove'] | [price='& FREE Shipping', shipingInfo='& FREE Shipping', seller='Part Doctors Appliance Cove'];SHORT_INFO: [asin='B0013E9OJK', availability=true, firstOffer=[price='$97.99', shipingInfo='& FREE Shipping', seller='Part Doctors Appliance Cove']]
B001ASF44I;true;false;Bemis;Bemis TC50TTA000 Marine Bowl Molded Wood Toilet Seat, White;;19.45;& FREE shipping on orders over $25.00.;;TC50TTA000;TC50TTA000;B001ASF44I;4.5;151;17937;Tools & Home Improvement ;Fri Jun 06 00:00:00 EEST 2008;OFFERS:;SHORT_INFO: [asin='B01MQMM1BC', availability=true, firstOffer=[price='$39.51', shipingInfo='+ $3.90shipping', seller='ebsydney ebsydney Nathan bookstore PROSPERNIA American Shopping kingmakerbooks Palm Great']] | [asin='B001ASF44I', availability=true, firstOffer=null]
B01GWEKJFI;true;false;Ecosoft;Ecosoft 3 Stage Under Sink Water Filtration System For Clean and Healthy Drinking Water, Blue;Clean Sip;114.89;& FREE shipping.;;FMV3ECOUS;FMV3ECOUS;B01GWEKJFI;4.5;181;20828;Tools & Home Improvement ;Fri Jun 10 00:00:00 EEST 2016;OFFERS: [price='$114.89', shipingInfo='& FREE ShippingDetails', seller='Clean Sip'] | [price='$114.89', shipingInfo='', seller='Clean Sip'] | [price='& FREE ShippingDetails', shipingInfo='& FREE ShippingDetails', seller='Clean Sip'];SHORT_INFO: [asin='B01GWEKJFI', availability=true, firstOffer=[price='$114.89', shipingInfo='& FREE ShippingDetails', seller='Clean Sip']]
B01M01EDHK;true;false;Aquaboon;Aquaboon 6-PACK Of 5 Micron 10" Sediment Water Filter For Any Standard RO Unit by;FILTERWAY;14.89;& FREE shipping on orders over $25.00 shipped by Amazon.;;;;B01M01EDHK;4.4;145;10045;Home & Kitchen ;Tue Aug 07 05:12:13 EEST 2018;OFFERS: [price='$14.89', shipingInfo='& FREE Shipping on orders over $25.00 shipped by Amazon. Details', seller='FILTERWAY'] | [price='$14.89', shipingInfo='', seller='FILTERWAY'] | [price='& FREE Shipping on orders over $25.00 shipped by Amazon. Details', shipingInfo='& FREE Shipping on orders over $25.00 shipped by Amazon. Details', seller='FILTERWAY'];SHORT_INFO:
B00QH6VEY2;true;false;Le Creuset;Le Creuset of America Signature Enameled Cast Iron Oval Wide Dutch Oven, 3.5-Quart, Flame;;300.0; $59.00 shipping;;;LS2517-272;B00QH6VEY2;4.5;58;179456;Kitchen & Dining ;Thu Apr 12 00:00:00 EEST 2012;OFFERS: [price='$300.00', shipingInfo='+ $59.00shipping', seller='AURAWARE'] | [price='+ $59.00shipping', shipingInfo='+ $59.00shipping', seller='AURAWARE'] | [price='+ $59.00shipping', shipingInfo='shipping', seller='AURAWARE'];SHORT_INFO: [asin='B00QH6VEY2', availability=true, firstOffer=[price='$300.00', shipingInfo='+ $59.00shipping', seller='AURAWARE']]
B00J9QVQ7C;true;false;Lodge;Lodge CRSGP12 Carbon Steel Grilling Pan, Pre-Seasoned, 12-inch;;40.99;& FREE shipping.;;;CRSGP12;B00J9QVQ7C;4.4;20;34607;Kitchen & Dining ;Sat Mar 15 00:00:00 EET 2014;OFFERS: [price='$40.99', shipingInfo='& FREE ShippingDetails', seller='Gatzies CA Global Distribution Deals Depot LLC MaxWarehouse BigKitchen CampSaver OpticsPlanet, Inc Rocky Mountain Farms Bargain The People'] | [price='$40.99', shipingInfo='', seller='Gatzies CA Global Distribution Deals Depot LLC MaxWarehouse BigKitchen CampSaver OpticsPlanet, Inc Rocky Mountain Farms Bargain The People'] | [price='& FREE ShippingDetails', shipingInfo='& FREE ShippingDetails', seller='Gatzies CA Global Distribution Deals Depot LLC MaxWarehouse BigKitchen CampSaver OpticsPlanet, Inc Rocky Mountain Farms Bargain The People'];SHORT_INFO: [asin='B00J9QVQ7C', availability=true, firstOffer=[price='$40.99', shipingInfo='& FREE ShippingDetails', seller='Gatzies CA Global Distribution Deals Depot LLC MaxWarehouse BigKitchen CampSaver OpticsPlanet, Inc Rocky Mountain Farms Bargain The People']]
B07FN1Y1CJ;true;false;AquaIV;[Premium] Rainfall Shower Head 8" High Pressure Waterfall - Made of FULL Stainless Steel - Square Rainfall Fixed Chrome High Flow Showerhead;AquaIV;33.99;& FREE shipping.;;;;B07FN1Y1CJ;5.0;260;10822;Tools & Home Improvement ;Thu Jul 19 00:00:00 EEST 2018;OFFERS: [price='$33.99', shipingInfo='& FREE ShippingDetails', seller='AquaIV'] | [price='$33.99', shipingInfo='', seller='AquaIV'] | [price='& FREE ShippingDetails', shipingInfo='& FREE ShippingDetails', seller='AquaIV'];SHORT_INFO:
B01KH4L5ZW;true;false;Ufaucet;Solid Brass Single Handle Pull Out Sprayer Oil Rubbed Bronze Kitchen Faucet, Pull Down Kitchen Sink Faucet With Deck Plate?;UFaucet;69.99;& FREE shipping.;;UF-QY09H-PM02H;COMINHKPR121670;B01KH4L5ZW;4.3;344;11203;Tools & Home Improvement ;Thu Jun 22 00:00:00 EEST 2017;OFFERS: [price='$69.99', shipingInfo='& FREE ShippingDetails', seller='UFaucet'] | [price='$69.99', shipingInfo='', seller='UFaucet'] | [price='& FREE ShippingDetails', shipingInfo='& FREE ShippingDetails', seller='UFaucet'];SHORT_INFO: [asin='B01KH4L5ZW', availability=true, firstOffer=[price='$69.99', shipingInfo='& FREE ShippingDetails', seller='UFaucet']]
B079FSPSMR;true;false;3new;3New 360°Swivel Water Saving Tap Aerator Nozzle Filter Water Saving Tap Diffuser Kitchen Accessories (Short);3NEW;9.5;& FREE shipping on orders over $25.00.;;43237-2;;B079FSPSMR;4.0;30;11008;Tools & Home Improvement ;Tue Jan 30 00:00:00 EET 2018;OFFERS:;SHORT_INFO: [asin='B079FSPSMR', availability=true, firstOffer=null]
B001UE8LK6;true;false;Le Creuset;Le Creuset Enameled Cast-Iron 5-1/2-Quart Round French Oven, White;;429.99; $22.34 shipping;;;L2501-2616S;B001UE8LK6;3.6;4;994144;Kitchen & Dining ;Mon May 05 00:00:00 EEST 2003;OFFERS: [price='$429.99', shipingInfo='+ $22.34shipping', seller='Lombardi's Gourmet Foods & Giftware'] | [price='+ $22.34shipping', shipingInfo='+ $22.34shipping', seller='Lombardi's Gourmet Foods & Giftware'] | [price='+ $22.34shipping', shipingInfo='shipping', seller='Lombardi's Gourmet Foods & Giftware'];SHORT_INFO: [asin='B001UE8LK6', availability=true, firstOffer=[price='$429.99', shipingInfo='+ $22.34shipping', seller='Lombardi's Gourmet Foods & Giftware']]
B07791ZV5R;true;false;Kraus;Kraus Britt Spot Free Stainless Pre-Rinse/Commercial Kitchen Faucet with Dual Function Sprayhead in all-Brite Finish, KPF-1690SFS;Kraus USA;179.9;& FREE shipping.;;KPF-1690SFS;;B07791ZV5R;3.5;5;52248;Tools & Home Improvement ;Wed Nov 08 00:00:00 EET 2017;OFFERS: [price='$179.90', shipingInfo='& FREE ShippingDetails', seller='Kraus USA Buildcom VMInnovations PoshHaus ShopLadder The Sink Discounters FaucetTownUSA Supply Cart Exotic Home Expo ReliableMarketplace'] | [price='$179.90', shipingInfo='', seller='Kraus USA Buildcom VMInnovations PoshHaus ShopLadder The Sink Discounters FaucetTownUSA Supply Cart Exotic Home Expo ReliableMarketplace'] | [price='& FREE ShippingDetails', shipingInfo='& FREE ShippingDetails', seller='Kraus USA Buildcom VMInnovations PoshHaus ShopLadder The Sink Discounters FaucetTownUSA Supply Cart Exotic Home Expo ReliableMarketplace'];SHORT_INFO: [asin='B07791ZV5R', availability=true, firstOffer=[price='$179.90', shipingInfo='& FREE ShippingDetails', seller='Kraus USA Buildcom VMInnovations PoshHaus ShopLadder The Sink Discounters FaucetTownUSA Supply Cart Exotic Home Expo ReliableMarketplace']] | [asin='B079Z5RDHC', availability=true, firstOffer=null] | [asin='B075R63CNX', availability=true, firstOffer=null]
B00092ZX1K;true;false;Le Creuset;Le Creuset Stoneware 12-Ounce Petite Pumpkin Casserole, Flame;Sparrow Hawk Cookware;179.95;& FREE shipping.;;;PG4160-1002;B00092ZX1K;4.2;10;565486;Kitchen & Dining ;Mon May 05 00:00:00 EEST 2003;OFFERS: [price='$179.95', shipingInfo='& FREE Shipping', seller='Sparrow Hawk Cookware Lombardi's Gourmet Foods & Giftware'] | [price='& FREE Shipping', shipingInfo='& FREE Shipping', seller='Sparrow Hawk Cookware Lombardi's Gourmet Foods & Giftware'];SHORT_INFO: [asin='B00092ZX1K', availability=true, firstOffer=[price='$179.95', shipingInfo='& FREE Shipping', seller='Sparrow Hawk Cookware Lombardi's Gourmet Foods & Giftware']]
B009PPFFLU;true;false;King Kooker;King Kooker Pre-seasoned Outdoor Cast Iron Dutch Oven with Feet, 8-Quart;;58.99;& FREE shipping.;;;CI8SCF;B009PPFFLU;4.4;15;233305;Patio, Lawn & Garden ;Tue Aug 07 05:12:13 EEST 2018;OFFERS: [price='$58.99', shipingInfo='& FREE Shipping', seller='PetsToys and More TK Ship Tempus & Co. BRV Marketplace BidTrade L.L.C. ShopLadder Norex Supply - Save up to 70% on everything! Bargain The People Give5ToCancer Max.Store'] | [price='& FREE Shipping', shipingInfo='& FREE Shipping', seller='PetsToys and More TK Ship Tempus & Co. BRV Marketplace BidTrade L.L.C. ShopLadder Norex Supply - Save up to 70% on everything! Bargain The People Give5ToCancer Max.Store'];SHORT_INFO: [asin='B009PPFFLU', availability=true, firstOffer=[price='$58.99', shipingInfo='& FREE Shipping', seller='PetsToys and More TK Ship Tempus & Co. BRV Marketplace BidTrade L.L.C. ShopLadder Norex Supply - Save up to 70% on everything! Bargain The People Give5ToCancer Max.Store']]
B0000V1PM6;true;false;Camp Chef;Camp Chef Deluxe 9 1/3-Quart Dutch Oven;;48.43;& FREE shipping.;;;DO12; B0000V1PM6;4.5;118;80834;Sports & Outdoors ;Tue Aug 07 05:12:13 EEST 2018;OFFERS: [price='$48.43', shipingInfo='& FREE ShippingDetails', seller='Outdoor Cooking Backcountry Red Commerce Mailzon BargainDayz Spaktacular Savings BestDealzToday XpW American Premium Store'] | [price='$48.43', shipingInfo='', seller='Outdoor Cooking Backcountry Red Commerce Mailzon BargainDayz Spaktacular Savings BestDealzToday XpW American Premium Store'] | [price='& FREE ShippingDetails', shipingInfo='& FREE ShippingDetails', seller='Outdoor Cooking Backcountry Red Commerce Mailzon BargainDayz Spaktacular Savings BestDealzToday XpW American Premium Store'];SHORT_INFO: [asin='B0000V1PM6', availability=true, firstOffer=[price='$48.43', shipingInfo='& FREE ShippingDetails', seller='Outdoor Cooking Backcountry Red Commerce Mailzon BargainDayz Spaktacular Savings BestDealzToday XpW American Premium Store']]
B07BWFS2DT;true;false;ROVOGO;ROVOGO Multi-Function Bathroom Shower Panel Tower System, 304 Stainless Steel, Black and Chrome Finish, with Water Temperature Display, Rainfall Shower, 2 Body Massage Sprays and 3-Function Hand Showe;ROVOGO;189.99;& FREE shipping.;;;;B07BWFS2DT;0.0;0;373286;Tools & Home Improvement ;Tue Apr 03 00:00:00 EEST 2018;OFFERS: [price='$189.99', shipingInfo='& FREE ShippingDetails', seller='ROVOGO'] | [price='$189.99', shipingInfo='', seller='ROVOGO'] | [price='& FREE ShippingDetails', shipingInfo='& FREE ShippingDetails', seller='ROVOGO'];SHORT_INFO:
B000BVS0D2;true;false;Master Plumber;Master Plumber 224-048 MP Toilet Seat Hinge, Chrome;Great Brands USA;11.45;& FREE shipping.;;224-048;224-048;B000BVS0D2;3.8;167;44710;Tools & Home Improvement ;Wed Aug 17 00:00:00 EEST 2005;OFFERS: [price='$10.00', shipingInfo='& FREE Shipping', seller='Gatzies Great Brands USA  TrueValueSuperStore'] | [price='& FREE Shipping', shipingInfo='& FREE Shipping', seller='Gatzies Great Brands USA  TrueValueSuperStore'];SHORT_INFO: [asin='B000BVS0D2', availability=true, firstOffer=[price='$10.00', shipingInfo='& FREE Shipping', seller='Gatzies Great Brands USA  TrueValueSuperStore']]
B00176GZDW;true;false;Moen;Moen 93980 Replacement Handle Mechanism Kit for One-Handle Kitchen Faucet Repairs;;16.62;& FREE shipping on orders over $25.00.;;93980;93980;B00176GZDW;4.5;184;11711;Tools & Home Improvement ;Fri Apr 04 00:00:00 EEST 2008;OFFERS:;SHORT_INFO: [asin='B00176GZDW', availability=true, firstOffer=null]
B00QH9YKMC;true;false;Corning - Pyrex - Visions;Corning Visions Ware 5 Qt Amber Dutch Oven Pot;;199.99; $21.99 shipping;;;;B00QH9YKMC;0.0;0;968087;Kitchen & Dining ;Tue Dec 02 00:00:00 EET 2014;OFFERS:;SHORT_INFO:
B072FR1RGG;true;false;Natural Rapids;Universal Shower Head Water Filter - Works Best to Remove Chlorine & Hard Water with any Showerhead - 2 Water-Softener Replaceable Multi-Stage Cartridges - By Natural Rapids, Chrome;FIT301;25.99;& FREE shipping.;;43234-16903;;B072FR1RGG;4.7;86;19151;Tools & Home Improvement ;Thu May 25 00:00:00 EEST 2017;OFFERS: [price='$25.99', shipingInfo='& FREE ShippingDetails', seller='FIT301'] | [price='$25.99', shipingInfo='', seller='FIT301'] | [price='& FREE ShippingDetails', shipingInfo='& FREE ShippingDetails', seller='FIT301'];SHORT_INFO: [asin='B072FR1RGG', availability=true, firstOffer=[price='$25.99', shipingInfo='& FREE ShippingDetails', seller='FIT301']]
B001IDY5QS;true;false;Anolon;Anolon Chef Clad Stainless Steel 4-Quart Covered Dutch Oven;;169.99; $59.13 shipping;;;30485;B001IDY5QS;4.0;7;604423;Kitchen & Dining ;Mon May 05 00:00:00 EEST 2003;OFFERS: [price='$169.99', shipingInfo='+ $59.13shipping', seller='Super Crazy Deals'] | [price='+ $59.13shipping', shipingInfo='+ $59.13shipping', seller='Super Crazy Deals'] | [price='+ $59.13shipping', shipingInfo='shipping', seller='Super Crazy Deals'];SHORT_INFO: [asin='B001IDY5QS', availability=true, firstOffer=[price='$169.99', shipingInfo='+ $59.13shipping', seller='Super Crazy Deals']]
B06WGLP5VV;true;false;Kohler;Kohler K-R10651-SD-VS Sous Pro-Style Single-Handle Pull-Down Sprayer Kitchen Faucet in Vibrant Stainless;AZSuperCheap;244.99; $16.49 shipping;;K-R10651-SD-VS;K-R10651-SD-VS;B06WGLP5VV;4.7;33;1337;Industrial & Scientific ;Wed May 25 00:00:00 EEST 2016;OFFERS: [price='$180.00', shipingInfo='+ $16.49shipping', seller='Cellulars and more GAME OVER ELECTRONICS AZSuperCheap InstantInventory OCSParts BidTrade L.L.C. TSR Wholesale MRT Global Kest Enterprises LLC Rotwiller pup'] | [price='+ $16.49shipping', shipingInfo='+ $16.49shipping', seller='Cellulars and more GAME OVER ELECTRONICS AZSuperCheap InstantInventory OCSParts BidTrade L.L.C. TSR Wholesale MRT Global Kest Enterprises LLC Rotwiller pup'] | [price='+ $16.49shipping', shipingInfo='shipping', seller='Cellulars and more GAME OVER ELECTRONICS AZSuperCheap InstantInventory OCSParts BidTrade L.L.C. TSR Wholesale MRT Global Kest Enterprises LLC Rotwiller pup'];SHORT_INFO: [asin='B06WGLP5VV', availability=true, firstOffer=[price='$180.00', shipingInfo='+ $16.49shipping', seller='Cellulars and more GAME OVER ELECTRONICS AZSuperCheap InstantInventory OCSParts BidTrade L.L.C. TSR Wholesale MRT Global Kest Enterprises LLC Rotwiller pup']]
B0026QGAPA;true;false;Premier Copper Products;Premier Copper Products W900-WAX Copper Sink Wax Protectant, Clear;Plumbing Overstock;19.99;& FREE shipping.;;W900-WAX;W900-WAX;B0026QGAPA;3.8;85;8820;Tools & Home Improvement ;Tue Jun 16 00:00:00 EEST 2009;OFFERS: [price='$19.99', shipingInfo='& FREE Shipping', seller='Plumbing Overstock FIRST LUXURY BATH & DECOR DESIGN plumbingwholesaler Eli Homes for Abused Children Hardware By Design Copper Kitchen and Bath HomeProShops Buildcom'] | [price='& FREE Shipping', shipingInfo='& FREE Shipping', seller='Plumbing Overstock FIRST LUXURY BATH & DECOR DESIGN plumbingwholesaler Eli Homes for Abused Children Hardware By Design Copper Kitchen and Bath HomeProShops Buildcom'];SHORT_INFO: [asin='B0026QGAPA', availability=true, firstOffer=[price='$19.99', shipingInfo='& FREE Shipping', seller='Plumbing Overstock FIRST LUXURY BATH & DECOR DESIGN plumbingwholesaler Eli Homes for Abused Children Hardware By Design Copper Kitchen and Bath HomeProShops Buildcom']] | [asin='B008RDS6VW', availability=true, firstOffer=[price='$1,350.00', shipingInfo='& FREE Shipping', seller='HomeProShops Hardware By Design Buildcom plumbingwholesaler Eli Homes for Abused Children FIRST LUXURY BATH & DECOR DESIGN Britt & Jules Britt & Jules BidTrade L.L.C.']] | [asin='B00GDQO33A', availability=true, firstOffer=[price='$1,899.00', shipingInfo='& FREE Shipping', seller='Corbel Universe Hardware By Design']]
B001KKRCFA;true;false;LUXE Bidet;Luxe Bidet MB110 Fresh Water Spray Non-Electric Mechanical Bidet Toilet Seat Attachment;Luxe Shop;23.95;& FREE shipping on orders over $25.00.;;MB110;MB110;B001KKRCFA;4.5;2,176;12535;Tools & Home Improvement ;Fri Dec 12 00:00:00 EET 2008;OFFERS:;SHORT_INFO: [asin='B075MMHQX7', availability=true, firstOffer=[price='$29.99', shipingInfo='& FREE ShippingDetails', seller='Healthy Homestore']] | [asin='B01AX865Q6', availability=true, firstOffer=null] | [asin='B001KKRCFA', availability=true, firstOffer=null]
B01N07BKLN;true;false;Belgique;Belgique Hard Anodized 7.5 Qt. Covered Dutch Oven;;64.99; $10.99 shipping;;;;B01N07BKLN;0.0;0;1100864;Kitchen & Dining ;Thu Nov 10 00:00:00 EET 2016;OFFERS: [price='$64.99', shipingInfo='+ $10.99shipping', seller='Beaumart Store'] | [price='+ $10.99shipping', shipingInfo='+ $10.99shipping', seller='Beaumart Store'] | [price='+ $10.99shipping', shipingInfo='shipping', seller='Beaumart Store'];SHORT_INFO:
B00176BI2U;true;false;Moen;Moen 116651BN 6-Inch Straight Replacement Shower Extension, Brushed Nickel;Babor - Institut;11.65;& FREE shipping on orders over $25.00.;;116651BN;116651BN;B00176BI2U;4.4;148;28797;Tools & Home Improvement ;Thu Oct 04 00:00:00 EEST 2007;OFFERS: [price='$11.65', shipingInfo='& FREE Shipping on orders over $25.00 shipped by Amazon. Details', seller='Babor - Institut  T-BAG PlumberStock ReliableMarketplace eFaucets Showerdoordirect Crawford Supply Co. AF Supply Bath1'] | [price='$11.65', shipingInfo='', seller='Babor - Institut  T-BAG PlumberStock ReliableMarketplace eFaucets Showerdoordirect Crawford Supply Co. AF Supply Bath1'] | [price='& FREE Shipping on orders over $25.00 shipped by Amazon. Details', shipingInfo='& FREE Shipping on orders over $25.00 shipped by Amazon. Details', seller='Babor - Institut  T-BAG PlumberStock ReliableMarketplace eFaucets Showerdoordirect Crawford Supply Co. AF Supply Bath1'];SHORT_INFO: [asin='B00176BI2U', availability=true, firstOffer=[price='$11.65', shipingInfo='& FREE Shipping on orders over $25.00 shipped by Amazon. Details', seller='Babor - Institut  T-BAG PlumberStock ReliableMarketplace eFaucets Showerdoordirect Crawford Supply Co. AF Supply Bath1']]
B075RYT266;true;false;Bialetti;Bialetti Aeternum Revolution Ceramic Nonstick Fry Pan (10");Bargain Wholesale Warehouse;34.99;& FREE shipping.;;;;B075RYT266;5.0;1;145415;Kitchen & Dining ;Tue Sep 19 00:00:00 EEST 2017;OFFERS: [price='$34.99', shipingInfo='& FREE Shipping', seller='Bargain Wholesale Warehouse Esoterique'] | [price='& FREE Shipping', shipingInfo='& FREE Shipping', seller='Bargain Wholesale Warehouse Esoterique'];SHORT_INFO:
B0746C3FNZ;true;false;2 Lb. Depot;2LB Depot Wide Shower Curtain Rings/Hooks Set, Decorative Oil Rubbed Bronze Finish, Easy Glide Rollers, 100% Rustproof Stainless Steel, Set of 12 Rings for Shower Rods;2LB Depot;13.95;& FREE shipping on orders over $25.00.;;;;B0746C3FNZ;4.3;60;28550;Home & Kitchen ;Tue Aug 07 05:12:13 EEST 2018;OFFERS: [price='$13.95', shipingInfo='& FREE Shipping on orders over $25.00 shipped by Amazon. Details', seller='2LB Depot 2LB Depot'] | [price='$13.95', shipingInfo='', seller='2LB Depot 2LB Depot'] | [price='& FREE Shipping on orders over $25.00 shipped by Amazon. Details', shipingInfo='& FREE Shipping on orders over $25.00 shipped by Amazon. Details', seller='2LB Depot 2LB Depot'];SHORT_INFO:
B005PLPFUE;true;false;Zenna Home;Zenna Home 775RB, Tension Shower Curtain Rod, 44 to 72-Inch, Oil Rubbed Bronze;;24.53;& FREE shipping on orders over $25.00.;;;775RB;B005PLPFUE;3.7;467;36632;Home & Kitchen ;Tue Aug 07 05:12:13 EEST 2018;OFFERS: [price='$24.53', shipingInfo='& FREE Shipping on orders over $25.00 shipped by Amazon. Details', seller='kimmae17'] | [price='$24.53', shipingInfo='', seller='kimmae17'] | [price='& FREE Shipping on orders over $25.00 shipped by Amazon. Details', shipingInfo='& FREE Shipping on orders over $25.00 shipped by Amazon. Details', seller='kimmae17'];SHORT_INFO: [asin='B005PLPFUE', availability=true, firstOffer=[price='$24.53', shipingInfo='& FREE Shipping on orders over $25.00 shipped by Amazon. Details', seller='kimmae17']] | [asin='B01M2X1ML4', availability=true, firstOffer=[price='$44.99', shipingInfo='& FREE ShippingDetails', seller='Vidan Home Solutions']]
B0077PN31E;true;false;Imusa;IMUSA TAD91623 Hammered Dutch Oven, 10 quart, Grey;;38.99;& FREE shipping.;;;TAD91623;B0077PN31E;5.0;1;769219;Kitchen & Dining ;Sat Dec 03 00:00:00 EET 2011;OFFERS: [price='$38.99', shipingInfo='& FREE Shipping', seller='Ferdel Promotions CLDesigns'] | [price='& FREE Shipping', shipingInfo='& FREE Shipping', seller='Ferdel Promotions CLDesigns'];SHORT_INFO: [asin='B0077PN31E', availability=true, firstOffer=[price='$38.99', shipingInfo='& FREE Shipping', seller='Ferdel Promotions CLDesigns']]
B0744TC3PW;true;false;iSpring;iSpring ED2000 Whole House Electronic Descaler Water Conditioner, Silver;iSpring Water Systems;149.99;& FREE shipping.;;ED2000;ED2000;B0744TC3PW;4.2;47;17513;Tools & Home Improvement ;Tue Aug 02 00:00:00 EEST 2016;OFFERS: [price='$149.99', shipingInfo='& FREE ShippingDetails', seller='iSpring Water Systems iSpring Water Systems'] | [price='$149.99', shipingInfo='', seller='iSpring Water Systems iSpring Water Systems'] | [price='& FREE ShippingDetails', shipingInfo='& FREE ShippingDetails', seller='iSpring Water Systems iSpring Water Systems'];SHORT_INFO: [asin='B0744TC3PW', availability=true, firstOffer=[price='$149.99', shipingInfo='& FREE ShippingDetails', seller='iSpring Water Systems iSpring Water Systems']] | [asin='B01JK75FCG', availability=true, firstOffer=[price='$217.00', shipingInfo='& FREE Shipping', seller='Supply Cart']]
