asin;availability;promoOffer;vendor;productName;buyBoxSeller;buyBoxPrice;buyBoxShipping;brand;partNumber;itemModelNumber;asinDomin;rating;quantity;bSR;bSRCategory;dateFirstAvailable;isNew
B01K7MXF0W;false;false;Starfrit;Starfrit THE ROCK by Fry Pans with Bakelite Handles (Set of 2), Black;;32.87;;;;060740-002-0000; B01K7MXF0W;4.4;36;27791;Beauty & Personal Care ;Tue Aug 07 05:12:10 EEST 2018;OFFERS:;SHORT_INFO: [asin='B01K7MXF0W', availability=false, firstOffer=null] | [asin='B01M7MBM7K', availability=true, firstOffer=[price='$45.47', shipingInfo='+ $2.43shipping', seller='MonsoonCloud Moon Tech IPC-Store kentshop']]
B01M7W3L8U;true;false;Le Creuset;Le Creuset 7 1/4 Qt. Cast Iron Round French Oven - Dune;;429.99; $4.49 shipping;;;;B01M7W3L8U;0.0;0;1182612;Kitchen & Dining ;Sat Oct 29 00:00:00 EEST 2016;OFFERS: [price='$429.99', shipingInfo='+ $4.49shipping', seller='Premium Pots'] | [price='+ $4.49shipping', shipingInfo='+ $4.49shipping', seller='Premium Pots'] | [price='+ $4.49shipping', shipingInfo='shipping', seller='Premium Pots'];SHORT_INFO:
B07892Z5SH;true;false;K&J;Universal Kitchen Sink Stopper -Garbage Disposal Plug - Kitchen Sink Plug for Insinkerator, Kitchenaid, Waste King, Kohler And More! … (Brushed Nickel);K & J Products;7.95;& FREE shipping on orders over $25.00 shipped by Amazon.;;KJDPV;;B07892Z5SH;0.0;0;21638;Tools & Home Improvement ;Wed Dec 13 00:00:00 EET 2017;OFFERS: [price='$7.95', shipingInfo='& FREE Shipping on orders over $25.00 shipped by Amazon. Details', seller='K & J Products'] | [price='$7.95', shipingInfo='', seller='K & J Products'] | [price='& FREE Shipping on orders over $25.00 shipped by Amazon. Details', shipingInfo='& FREE Shipping on orders over $25.00 shipped by Amazon. Details', seller='K & J Products'];SHORT_INFO: [asin='B07892Z5SH', availability=true, firstOffer=[price='$7.95', shipingInfo='& FREE Shipping on orders over $25.00 shipped by Amazon. Details', seller='K & J Products']]
B001B3XO9O;true;false;Corning Ware;Corning Vision Visions 4.5 L Round Dutch Oven with Lid;;64.99; $6.49 shipping;;;SYNCHKG011602;B001B3XO9O;3.0;9;271011;Kitchen & Dining ;Sun Jun 15 00:00:00 EEST 2008;OFFERS:;SHORT_INFO: [asin='B001B3XO9O', availability=true, firstOffer=null]
B002CML99U;true;false;Staub;Staub Mini .25 Quart Oval Cocotte, Basil;;56.5; $5.49 shipping;;;1101185;B002CML99U;0.0;0;1466687;Kitchen & Dining ;Fri May 01 00:00:00 EEST 2009;OFFERS:;SHORT_INFO: [asin='B002CML99U', availability=true, firstOffer=null]
B017QKKRZE;true;false;Atlas Trd.Co.;Atlas Soy Turkiye Hammered Thick Copper Silver Lined Rondeau Pot/Pan (9"/24 cm with Lid);;395.0; $24.49 shipping;;;AT;B017QKKRZO;0.0;0;604916;Kitchen & Dining ;Sun Nov 08 00:00:00 EET 2015;OFFERS:;SHORT_INFO: [asin='B017QKKRZO', availability=true, firstOffer=[price='$395.00', shipingInfo='+ $24.49shipping', seller='Atlas Trading Company Atlas Trading Company']] | [asin='B017QI4C3O', availability=true, firstOffer=[price='$249.99', shipingInfo='+ $19.49shipping', seller='Atlas Trading Company Atlas Trading Company']]
B002FAYE8M;true;false;Moen;Moen BP6918CH Madison 18-Inch Towel Bar, Chrome;;13.05;& FREE shipping on orders over $25.00.;;BP6918CH;BP6918CH;B002FAYE8M;4.4;127;10198;Tools & Home Improvement ;Tue Feb 02 00:00:00 EET 2010;OFFERS:;SHORT_INFO: [asin='B002FAYE8M', availability=true, firstOffer=null]
B00BK6G5TS;true;false;Vision;Corning Vision Cranberry Non-stick 5 L (Quarts) Dutch Oven with Lid;;125.23;& FREE shipping.;;;;B00BK6G5TS;3.5;3;848882;Kitchen & Dining ;Sat Feb 23 00:00:00 EET 2013;OFFERS:;SHORT_INFO:
B00I2XQ56U;true;false;Coflex;Snappy Trap 1 1/2" All-In-One-Drain Kit for Double Bowl Kitchen Sinks;Coflex;27.99;& FREE shipping.;;DK-110;DK-110;B00I2XQ56U;4.3;621;15035;Tools & Home Improvement ;Tue Feb 18 00:00:00 EET 2014;OFFERS:;SHORT_INFO: [asin='B00I2XQ56U', availability=true, firstOffer=null]
B0051Z5Q2Q;true;false;Berghoff;BergHOFF Neo Cast 2.5-Quart Covered Casserole;;87.1; $10.49 shipping;;;3502555;B0051Z5Q2Q;0.0;0;989054;Kitchen & Dining ;Wed Sep 28 00:00:00 EEST 2011;OFFERS: [price='$87.10', shipingInfo='+ $10.49shipping', seller='BBBProducts'] | [price='+ $10.49shipping', shipingInfo='+ $10.49shipping', seller='BBBProducts'] | [price='+ $10.49shipping', shipingInfo='shipping', seller='BBBProducts'];SHORT_INFO: [asin='B0051Z5Q2Q', availability=true, firstOffer=[price='$87.10', shipingInfo='+ $10.49shipping', seller='BBBProducts']]
B0053OCWU4;true;false;Snow Peak;Snow Peak Japanese Dutch Oven - 26cm;The Mountain Air;249.95;& FREE shipping.;;;CS-520; B0053OCWU4;-1.0;0;1082059;Sports & Outdoors ;Tue Aug 07 05:12:10 EEST 2018;OFFERS: [price='$249.95', shipingInfo='& FREE ShippingDetails', seller='The Mountain Air S&W Group CampSaver BackcountryGear Backcountry Zendo Japan AmazingJapan cocoroNET Great Warehouse D-Circle (D-Circle (We recommend Expedited shipping, if you are in a hurry.Standard shipping takes about 3-5 weeks.)'] | [price='$249.95', shipingInfo='', seller='The Mountain Air S&W Group CampSaver BackcountryGear Backcountry Zendo Japan AmazingJapan cocoroNET Great Warehouse D-Circle (D-Circle (We recommend Expedited shipping, if you are in a hurry.Standard shipping takes about 3-5 weeks.)'] | [price='& FREE ShippingDetails', shipingInfo='& FREE ShippingDetails', seller='The Mountain Air S&W Group CampSaver BackcountryGear Backcountry Zendo Japan AmazingJapan cocoroNET Great Warehouse D-Circle (D-Circle (We recommend Expedited shipping, if you are in a hurry.Standard shipping takes about 3-5 weeks.)'];SHORT_INFO: [asin='B0053OCWU4', availability=true, firstOffer=[price='$249.95', shipingInfo='& FREE ShippingDetails', seller='The Mountain Air S&W Group CampSaver BackcountryGear Backcountry Zendo Japan AmazingJapan cocoroNET Great Warehouse D-Circle (D-Circle (We recommend Expedited shipping, if you are in a hurry.Standard shipping takes about 3-5 weeks.)']]
B00ORKIY84;true;false;Better Chef;Round Dutch Oven Size: 2 Qt.;PRICE 2 SAVE;28.99;& FREE shipping.;;;91589226M;B00ORKIY84;4.0;1;1478330;Kitchen & Dining ;Wed Oct 22 00:00:00 EEST 2014;OFFERS: [price='$28.99', shipingInfo='& FREE Shipping', seller='PRICE 2 SAVE eTronicspro kentshop BinkieMelane'] | [price='& FREE Shipping', shipingInfo='& FREE Shipping', seller='PRICE 2 SAVE eTronicspro kentshop BinkieMelane'];SHORT_INFO: [asin='B00ORKIY84', availability=true, firstOffer=[price='$28.99', shipingInfo='& FREE Shipping', seller='PRICE 2 SAVE eTronicspro kentshop BinkieMelane']]
B0153N5WIS;true;false;Tramontina;Tramontina 6.5 Qt Round Dutch Oven Shadow Gray Enameled Cast Iron;;139.99;& FREE shipping.;;;;B0153N5WIS;5.0;5;506241;Kitchen & Dining ;Tue Sep 08 00:00:00 EEST 2015;OFFERS: [price='$139.99', shipingInfo='& FREE Shipping', seller='D-Unit LVM Retail'] | [price='& FREE Shipping', shipingInfo='& FREE Shipping', seller='D-Unit LVM Retail'];SHORT_INFO:
B000AEGCOO;false;false;Carex Health Brands;Carex Universal Transfer Bench, Bath Transfer Bench with Exact Level Adjustable Legs, Convertible to Right or Left Hand Entry;;64.49;;;;B170C0; B000AEGCOO;4.3;194;26310;Health & Household ;Tue Aug 07 05:12:10 EEST 2018;OFFERS:;SHORT_INFO: [asin='B000AEGCOO', availability=false, firstOffer=null]
B07DCPGXXY;true;false;CLOFY;CLOFY Full Chrome Shower Head, 28-Setting Combo Shower Heads with Holder & Hose, 2 in 1 High Pressure Handheld Shower Head Shower Faucet;CLOFY US;29.99;& FREE shipping.;;USATP126580/SFH-YS01RC;;B07DCPGXXY;4.3;9;5582;Tools & Home Improvement ;Tue May 29 00:00:00 EEST 2018;OFFERS: [price='$29.99', shipingInfo='& FREE ShippingDetails', seller='CLOFY US'] | [price='$29.99', shipingInfo='', seller='CLOFY US'] | [price='& FREE ShippingDetails', shipingInfo='& FREE ShippingDetails', seller='CLOFY US'];SHORT_INFO: [asin='B07DCPGXXY', availability=true, firstOffer=[price='$29.99', shipingInfo='& FREE ShippingDetails', seller='CLOFY US']]
B01M3WEZVM;true;false;Tramontina;Tramontina 80151/585DS Ceramic-Reinforced Nonstick Fry Pan Set, 3 Piece, Red, Made in USA;US Supply Market;34.76;& FREE shipping.;;;80151/585DS;B01M3WEZVM;4.5;6;169869;Home & Kitchen ;Tue Aug 07 05:12:10 EEST 2018;OFFERS: [price='$34.76', shipingInfo='& FREE Shipping', seller='US Supply Market High Sky Qty Affordable Lif3styl3 Hars Discount Outlet clickandgrab808 HRM Trade Inc Fine Trade jrstore100 Mandi_Laba T.L. Industries'] | [price='& FREE Shipping', shipingInfo='& FREE Shipping', seller='US Supply Market High Sky Qty Affordable Lif3styl3 Hars Discount Outlet clickandgrab808 HRM Trade Inc Fine Trade jrstore100 Mandi_Laba T.L. Industries'];SHORT_INFO: [asin='B01M3WEZVM', availability=true, firstOffer=[price='$34.76', shipingInfo='& FREE Shipping', seller='US Supply Market High Sky Qty Affordable Lif3styl3 Hars Discount Outlet clickandgrab808 HRM Trade Inc Fine Trade jrstore100 Mandi_Laba T.L. Industries']]
B00GJ8WWAS;true;false;Food Network;Food Network 5.5-qt. Enamel Cast-Iron Dutch Oven;;88.0; $19.99 shipping;;;5116054;B00GJ8WWAS;0.0;0;787613;Kitchen & Dining ;Fri Dec 13 00:00:00 EET 2013;OFFERS: [price='$88.00', shipingInfo='+ $19.99shipping', seller='baanks'] | [price='+ $19.99shipping', shipingInfo='+ $19.99shipping', seller='baanks'] | [price='+ $19.99shipping', shipingInfo='shipping', seller='baanks'];SHORT_INFO: [asin='B00GJ8WWAS', availability=true, firstOffer=[price='$88.00', shipingInfo='+ $19.99shipping', seller='baanks']]
B0007NIBDS;true;false;Le Creuset;Le Creuset Enameled Cast-Iron 9-Quart Round French Oven, Dune;;529.99; $13.49 shipping;;;L2501-3068;B0007NIBDS;4.6;4;974590;Kitchen & Dining ;Mon May 05 00:00:00 EEST 2003;OFFERS: [price='$529.99', shipingInfo='+ $13.49shipping', seller='Premium Pots'] | [price='+ $13.49shipping', shipingInfo='+ $13.49shipping', seller='Premium Pots'] | [price='+ $13.49shipping', shipingInfo='shipping', seller='Premium Pots'];SHORT_INFO: [asin='B0007NIBDS', availability=true, firstOffer=[price='$529.99', shipingInfo='+ $13.49shipping', seller='Premium Pots']]
B01H4ETQ40;false;false;Staub;Staub Cast Iron Petite French Oven (1.5-qt, Grenadine);;0.0;;;;40511-561;B01H4ETQ40;3.0;2;563761;Kitchen & Dining ;Wed Jun 15 00:00:00 EEST 2016;OFFERS:;SHORT_INFO: [asin='B00266HAAY', availability=true, firstOffer=[price='$99.95', shipingInfo='& FREE ShippingDetails', seller='J.L. Hufford Chefs Corner Store eKitchenWorld ZWILLING J.A. HENCKELS']] | [asin='B003G65YQ0', availability=true, firstOffer=null] | [asin='B01BKTM34U', availability=true, firstOffer=null]
B00940DVT4;true;false;OXO;OXO Good Grips Strong Hold Suction Balance Assist Bar for Bath and Shower with Non Slip Grip;;19.99;& FREE shipping on orders over $25.00.;;;1436280;B00940DVT4;4.0;224;31802;Home & Kitchen ;Tue Aug 07 05:12:10 EEST 2018;OFFERS:;SHORT_INFO: [asin='B00940DVT4', availability=true, firstOffer=null]
B0000DGQON;true;false;Le Creuset;Le Creuset Enameled Cast-Iron 2-Quart Round French Oven, Red;chacha JAPAN;370.69;& FREE shipping.;;;L2501-18-67;B0000DGQON;4.5;14;757196;Kitchen & Dining ;Mon Jun 03 00:00:00 EEST 2002;OFFERS: [price='$285.66', shipingInfo='& FREE Shipping', seller='ENDLESS-JAPAN ???JAPAN?Discount Store since2005 chacha JAPAN'] | [price='& FREE Shipping', shipingInfo='& FREE Shipping', seller='ENDLESS-JAPAN ???JAPAN?Discount Store since2005 chacha JAPAN'];SHORT_INFO: [asin='B0000DGQON', availability=true, firstOffer=[price='$285.66', shipingInfo='& FREE Shipping', seller='ENDLESS-JAPAN ???JAPAN?Discount Store since2005 chacha JAPAN']]
B01A3N8KAK;true;false;Avantco;Avantco S30 11 Qt. Soup Kettle Warmer - 120V, 400W;hedy4LESS;105.0; $4.49 shipping;;;s30;B01A3N8KAK;0.0;0;464582;Kitchen & Dining ;Sat Jan 02 00:00:00 EET 2016;OFFERS: [price='$109.49', shipingInfo='& FREE Shipping', seller='COOKASH hedy4LESS The Corner Mart MYCOOLPRODUCTS'] | [price='& FREE Shipping', shipingInfo='& FREE Shipping', seller='COOKASH hedy4LESS The Corner Mart MYCOOLPRODUCTS'];SHORT_INFO: [asin='B01A3N8KAK', availability=true, firstOffer=[price='$109.49', shipingInfo='& FREE Shipping', seller='COOKASH hedy4LESS The Corner Mart MYCOOLPRODUCTS']] | [asin='B07988N5S7', availability=true, firstOffer=[price='$86.95', shipingInfo='& FREE Shipping', seller='1Dealz hedy4LESS Monroe Systems for Business']]
B00S33BINO;true;false;CorningWare;Vintage Corning Ware Spice of Life Lexhalote La Marjolaine Dutch Oven with Lid 5 L Liter;;65.0; $8.99 shipping;;;A-5-B;B00S33BINO;5.0;1;746999;Kitchen & Dining ;Sat Jan 10 00:00:00 EET 2015;OFFERS:;SHORT_INFO: [asin='B00M3E0600', availability=true, firstOffer=null] | [asin='B079N7VVR6', availability=true, firstOffer=null] | [asin='B00CIGWII6', availability=true, firstOffer=null]
B001AEGC0W;true;false;Le Creuset;Le Creuset Enameled Cast-Iron 3-1/2-Quart Round French Oven, Black Onyx;;389.99; $9.49 shipping;;;L2501-2231S;B001AEGC0W;0.0;0;1197395;Kitchen & Dining ;Thu Jan 01 00:00:00 EET 2009;OFFERS: [price='$389.99', shipingInfo='+ $9.49shipping', seller='Premium Pots'] | [price='+ $9.49shipping', shipingInfo='+ $9.49shipping', seller='Premium Pots'] | [price='+ $9.49shipping', shipingInfo='shipping', seller='Premium Pots'];SHORT_INFO: [asin='B001AEGC0W', availability=true, firstOffer=[price='$389.99', shipingInfo='+ $9.49shipping', seller='Premium Pots']]
B00P4SVMVO;true;false;Better Chef;Round Dutch Oven Size: 5 Qt.;CE Showroom;33.96;& FREE shipping.;;;D502R;B00P4SVMVO;3.1;3;793585;Kitchen & Dining ;Sun Nov 02 00:00:00 EET 2014;OFFERS: [price='$33.96', shipingInfo='& FREE Shipping', seller='CE Showroom eTronicspro PRICE 2 SAVE kentshop BinkieMelane'] | [price='& FREE Shipping', shipingInfo='& FREE Shipping', seller='CE Showroom eTronicspro PRICE 2 SAVE kentshop BinkieMelane'];SHORT_INFO: [asin='B01DJHE3ZS', availability=true, firstOffer=[price='$47.99', shipingInfo='+ $6.99shipping', seller='kentshop']] | [asin='B00P4SVMVO', availability=true, firstOffer=[price='$33.96', shipingInfo='& FREE Shipping', seller='CE Showroom eTronicspro PRICE 2 SAVE kentshop BinkieMelane']] | [asin='B00PBBZSF0', availability=true, firstOffer=[price='$38.80', shipingInfo='& FREE Shipping', seller='eTronicspro Good Luck Bargains kentshop A.S.A.P...']]
B017ZAVOGQ;true;false;Gibson;Gibson 92138.02 Home Hummington Eco-Friendly 5-Quart Dutch Oven with Glass Lid, Multi-Size, Green by Gibson;;35.92;& FREE shipping.;;;;B017ZAVOGQ;0.0;0;1991927;Kitchen & Dining ;Mon Jan 11 00:00:00 EET 2016;OFFERS: [price='$35.92', shipingInfo='& FREE Shipping', seller='Freedom Sales L.L.C. E-TUBE Connect Buy Palm Great Lambel? TSR Wholesale Mandy777 Seedbed KingDom Fish'] | [price='& FREE Shipping', shipingInfo='& FREE Shipping', seller='Freedom Sales L.L.C. E-TUBE Connect Buy Palm Great Lambel? TSR Wholesale Mandy777 Seedbed KingDom Fish'];SHORT_INFO:
B06ZYC5NG5;true;false;Lake Industries;Universal 10 inch Carbon Block Water Filter Cartridge - Replacement CTO Water Purifier Filter, Activated Carbon (NSF 42 Certified) (3);Lake Industries;29.95;& FREE shipping on orders over $25.00.;;;;B06ZYC5NG5;4.2;49;41696;Home & Kitchen ;Tue Aug 07 05:12:10 EEST 2018;OFFERS:;SHORT_INFO:
B00QPOKU4Q;true;false;Cardinal Health - Med;ZCHSBH02 - Shower Chair with Back;The Medical Shop;29.49;& FREE shipping.;;FBA_34087;;B00QPOKU4Q;4.4;112;19720;Tools & Home Improvement ;Mon Dec 08 00:00:00 EET 2014;OFFERS: [price='$27.06', shipingInfo='& FREE Shipping', seller='AVALINE Treasure Zone The Medical Shop The Breathing Shop Katy Med Solutions discount place Medical Department Stores Medical Xpress Outlet PatientPharmacy Cascade Healthcare Solutions'] | [price='& FREE Shipping', shipingInfo='& FREE Shipping', seller='AVALINE Treasure Zone The Medical Shop The Breathing Shop Katy Med Solutions discount place Medical Department Stores Medical Xpress Outlet PatientPharmacy Cascade Healthcare Solutions'];SHORT_INFO: [asin='B00QPOKU4Q', availability=true, firstOffer=[price='$27.06', shipingInfo='& FREE Shipping', seller='AVALINE Treasure Zone The Medical Shop The Breathing Shop Katy Med Solutions discount place Medical Department Stores Medical Xpress Outlet PatientPharmacy Cascade Healthcare Solutions']]
B000RWGB1I;true;false;Staub;Staub 5-Quart Oval Cocotte, Basil;;200.0;& FREE shipping.;;;1102985;B000RWGB1I;4.0;12;467244;Kitchen & Dining ;Tue Jun 12 00:00:00 EEST 2007;OFFERS:;SHORT_INFO: [asin='B000RWGB1I', availability=true, firstOffer=null]
B015BZ8UNC;true;false;ShowerMaxx;ShowerMaxx Shower Head Premium 6 Spray Settings | Luxury Spa Detachable Handheld Showerhead | Extra Long Stretchable Stainless Steel Hose, Adjustable Mount & Teflon Tape | Chrome Hand Held Finish;QualityNLuxury Products;39.99;& FREE shipping.;;FBA_Handheld_Chrome;SYNCHKG090614;B015BZ8UNC;4.3;1,288;3082;Tools & Home Improvement ;Mon Sep 14 00:00:00 EEST 2015;OFFERS: [price='$39.99', shipingInfo='& FREE ShippingDetails', seller='QualityNLuxury Products'] | [price='$39.99', shipingInfo='', seller='QualityNLuxury Products'] | [price='& FREE ShippingDetails', shipingInfo='& FREE ShippingDetails', seller='QualityNLuxury Products'];SHORT_INFO: [asin='B01MZIPDBT', availability=true, firstOffer=[price='$58.99', shipingInfo='& FREE ShippingDetails', seller='S.K.LANG Products']] | [asin='B015BZ8UNC', availability=true, firstOffer=[price='$39.99', shipingInfo='& FREE ShippingDetails', seller='QualityNLuxury Products']]
B00F8DCX7W;true;false;Caroni;Caroni A180424 Easy Cooking Dutch-Oven with Glass Lid, 9.52-Inch;;79.95;& FREE shipping.;;;A180424;B00F8DCX7W;5.0;1;1102212;Kitchen & Dining ;Thu Sep 12 00:00:00 EEST 2013;OFFERS: [price='$79.95', shipingInfo='& FREE Shipping', seller='Max.Store'] | [price='& FREE Shipping', shipingInfo='& FREE Shipping', seller='Max.Store'];SHORT_INFO: [asin='B00F8DCX7W', availability=true, firstOffer=[price='$79.95', shipingInfo='& FREE Shipping', seller='Max.Store']]
B0007NIBD8;true;false;Le Creuset;Le Creuset Enameled Cast-Iron 5-1/2-Quart Round French Oven, Dune;;399.99; $10.99 shipping;;;L2501-2668;B0007NIBD8;5.0;9;806340;Kitchen & Dining ;Wed Apr 13 00:00:00 EEST 2005;OFFERS: [price='$399.99', shipingInfo='+ $10.99shipping', seller='Premium Pots'] | [price='+ $10.99shipping', shipingInfo='+ $10.99shipping', seller='Premium Pots'] | [price='+ $10.99shipping', shipingInfo='shipping', seller='Premium Pots'];SHORT_INFO: [asin='B0007NIBD8', availability=true, firstOffer=[price='$399.99', shipingInfo='+ $10.99shipping', seller='Premium Pots']]
B000HMBQVS;true;false;Mustee;Mustee 14 Utilatub Laundry Tub Floor Mount, 25-Inch x 23-Inch, White;DRecu Systems;40.48; $14.99 shipping;;FBA_14;14;B000HMBQVS;4.4;101;14567;Tools & Home Improvement ;Tue Nov 25 00:00:00 EET 2008;OFFERS: [price='$25.01', shipingInfo='+ $14.99shipping', seller='BoldhousePro HomeDirect.eStore Kfn DRecu Systems Brentwood Supply Co. ik_shop2006 HD ?nline American Premium Store * BTM * Quality Sourcing Partners'] | [price='+ $14.99shipping', shipingInfo='+ $14.99shipping', seller='BoldhousePro HomeDirect.eStore Kfn DRecu Systems Brentwood Supply Co. ik_shop2006 HD ?nline American Premium Store * BTM * Quality Sourcing Partners'] | [price='+ $14.99shipping', shipingInfo='shipping', seller='BoldhousePro HomeDirect.eStore Kfn DRecu Systems Brentwood Supply Co. ik_shop2006 HD ?nline American Premium Store * BTM * Quality Sourcing Partners'];SHORT_INFO: [asin='B00PB9WOF4', availability=true, firstOffer=[price='$100.63', shipingInfo='& FREE Shipping', seller='Gatzies']] | [asin='B073L1Q1BB', availability=true, firstOffer=[price='$44.95', shipingInfo='+ $22.20shipping', seller='Bargain The People Longbottom & Hardsaw Inc Gatzies  Ron's Home and Hardware Southfork Homecenter']] | [asin='B000HMBQVS', availability=true, firstOffer=[price='$25.01', shipingInfo='+ $14.99shipping', seller='BoldhousePro HomeDirect.eStore Kfn DRecu Systems Brentwood Supply Co. ik_shop2006 HD ?nline American Premium Store * BTM * Quality Sourcing Partners']]
B0096R9VYE;true;false;Better Chef;Better Chef 2-Quart Heavy-Gauge Aluminum Dutch Oven with Glass Lid;;14.63; $9.99 shipping;;;D201S;B0096R9VYE;0.0;0;2139157;Kitchen & Dining ;Mon Aug 19 00:00:00 EEST 2013;OFFERS:;SHORT_INFO: [asin='B0096R9VYE', availability=true, firstOffer=null] | [asin='B01CVV8D22', availability=true, firstOffer=[price='$34.45', shipingInfo='& FREE Shipping', seller='A.S.A.P... eTronicspro']] | [asin='B017ZAD6XK', availability=true, firstOffer=[price='$34.80', shipingInfo='& FREE Shipping', seller='eTronicspro A.S.A.P...']]
B00H3KF6Y0;true;false;Fluidmaster;Fluidmaster 507AKP7 2-Inch Toilet Flush Valve Repair Kit, with Gasket and Bolts;;12.24;& FREE shipping on orders over $25.00.;;507AKP7;507AKP7;B00H3KF6Y0;4.2;77;24757;Tools & Home Improvement ;Wed Dec 04 00:00:00 EET 2013;OFFERS:;SHORT_INFO: [asin='B00H3KF6Y0', availability=true, firstOffer=null]
B06X3TXV47;false;false;AlHAKIN;Lighted Makeup Mirror - 7" LED Vanity Mirror 10x Magnification Two-Sided Cosmetic Table Mirror Polished Chrome ALHAKIN;ALHAKIN;32.99;;;;; B06X3TXV47;3.4;66;25780;Beauty & Personal Care ;Tue Aug 07 05:12:10 EEST 2018;OFFERS:;SHORT_INFO:
B072QRJDJC;true;false;Nest Homeware;Nest Homeware dutch Oven - 3.5 quart;;250.0; $14.37 shipping;;;;B072QRJDJC;0.0;0;1530776;Kitchen & Dining ;Fri Jun 09 00:00:00 EEST 2017;OFFERS: [price='$250.00', shipingInfo='+ $14.37shipping', seller='Nest Homeware'] | [price='+ $14.37shipping', shipingInfo='+ $14.37shipping', seller='Nest Homeware'] | [price='+ $14.37shipping', shipingInfo='shipping', seller='Nest Homeware'];SHORT_INFO:
B00UUS9XWI;true;false;Bayou Classic;Bayou Classic 7439 Cast Iron Skillet, 16";easy-to-open packaging;51.4;& FREE shipping.;;;7439;B00UUS9XWI;4.3;87;11674;Patio, Lawn & Garden ;Tue Aug 07 05:12:10 EEST 2018;OFFERS:;SHORT_INFO: [asin='B00W3PVM8O', availability=true, firstOffer=[price='$159.50', shipingInfo='& FREE Shipping', seller='Northern Brewer Homebrewing Supply']] | [asin='B00UUS9XWI', availability=true, firstOffer=null] | [asin='B00W3PVGR6', availability=true, firstOffer=[price='$69.50', shipingInfo='& FREE Shipping', seller='Northern Brewer Homebrewing Supply']]
B0000C69L7;true;false;Le Creuset;Le Creuset Granite Oval French Oven 2.5 Qt.;;349.99; $17.79 shipping;;;;B0000C69L7;0.0;0;2528872;Kitchen & Dining ;Tue Apr 27 00:00:00 EEST 2004;OFFERS: [price='$349.99', shipingInfo='+ $17.79shipping', seller='Lombardi's Gourmet Foods & Giftware'] | [price='+ $17.79shipping', shipingInfo='+ $17.79shipping', seller='Lombardi's Gourmet Foods & Giftware'] | [price='+ $17.79shipping', shipingInfo='shipping', seller='Lombardi's Gourmet Foods & Giftware'];SHORT_INFO:
B014WH6LP4;true;false;Aroma Housewares;Aroma Doveware Dutch Oven, 2.5 quart, Midnight Black (ADC-103B);;119.99;& FREE shipping.;;;ADC-103B;B014WH4T3A;4.5;4;671766;Kitchen & Dining ;Fri Sep 04 00:00:00 EEST 2015;OFFERS:;SHORT_INFO: [asin='B014WH4T3A', availability=true, firstOffer=[price='$119.99', shipingInfo='& FREE Shipping', seller='AROMA Housewares']]
B0066H65NM;true;false;Tramontina;Tramontina 6.5q Cast Iron Dutch Oven Casserole;Livin Cyclades;55.48;& FREE shipping.;;;80131/612DS;B0066H65NM;4.4;8;253192;Kitchen & Dining ;Sat Nov 12 00:00:00 EET 2011;OFFERS: [price='$55.48', shipingInfo='& FREE Shipping', seller='Livin Cyclades Fine Trade'] | [price='& FREE Shipping', shipingInfo='& FREE Shipping', seller='Livin Cyclades Fine Trade'];SHORT_INFO: [asin='B0153NNMB2', availability=true, firstOffer=[price='$46.00', shipingInfo='& FREE Shipping', seller='JD's Discount Store Cook'sStore™ TradeDeal Wall to Wall Products Fine Trade Soup to Nuts Inc. Bargain Ship LLC CR Dealz ZillyZue Smartbrands Online LLC']] | [asin='B0066H65NM', availability=true, firstOffer=[price='$55.48', shipingInfo='& FREE Shipping', seller='Livin Cyclades Fine Trade']]
B01A3N8MFI;true;false;Avantco by MYCOOLPRODUCTS;Avantco W300BK 6 Qt. Round Black Countertop Soup Kettle Warmer - 110V, 300W;1Dealz;130.92;& FREE shipping.;;;;B01A3N8MFI;1.0;1;1085152;Kitchen & Dining ;Sun Apr 17 00:00:00 EEST 2016;OFFERS: [price='$130.92', shipingInfo='& FREE Shipping', seller='1Dealz Cliffmart LLC The Corner Mart MYCOOLPRODUCTS'] | [price='& FREE Shipping', shipingInfo='& FREE Shipping', seller='1Dealz Cliffmart LLC The Corner Mart MYCOOLPRODUCTS'];SHORT_INFO:
B01F6CNR56;true;false;Crock-Pot;Crock Pot Artisan 7QT Oval Dutch Oven, Burgundy;;110.24;& FREE shipping.;;;;B01F6CNR56;0.0;0;907841;Kitchen & Dining ;Wed May 04 00:00:00 EEST 2016;OFFERS: [price='$110.24', shipingInfo='& FREE Shipping', seller='TSR Wholesale Gifts You Will Remember LLC'] | [price='& FREE Shipping', shipingInfo='& FREE Shipping', seller='TSR Wholesale Gifts You Will Remember LLC'];SHORT_INFO:
B01FUZ9DHK;true;false;CEM Cookware;La Chamba Black Clay Colombian Dutch Oven, Large - 6.5 Quarts;;99.95; $10.49 shipping;;;C07;B01FUZ9DHK;0.0;0;1800452;Kitchen & Dining ;Wed May 18 00:00:00 EEST 2016;OFFERS: [price='$99.95', shipingInfo='+ $10.49shipping', seller='CEM Cookware'] | [price='+ $10.49shipping', shipingInfo='+ $10.49shipping', seller='CEM Cookware'] | [price='+ $10.49shipping', shipingInfo='shipping', seller='CEM Cookware'];SHORT_INFO: [asin='B01FUZ9DHK', availability=true, firstOffer=[price='$99.95', shipingInfo='+ $10.49shipping', seller='CEM Cookware']]
B019BP9R1M;true;false;Shaffer Berry;Shaffer-Berry Round Cast Iron Casserole Dish 9.5 Inch, 24cm-4l. 4.2qt-Charcoal;;39.0; $12.49 shipping;;;SY0246RC-C;B019BP9R1M;0.0;0;1269262;Kitchen & Dining ;Mon Dec 14 00:00:00 EET 2015;OFFERS: [price='$39.00', shipingInfo='+ $12.49shipping', seller='Shaffer-Berry'] | [price='+ $12.49shipping', shipingInfo='+ $12.49shipping', seller='Shaffer-Berry'] | [price='+ $12.49shipping', shipingInfo='shipping', seller='Shaffer-Berry'];SHORT_INFO: [asin='B019BP9R1M', availability=true, firstOffer=[price='$39.00', shipingInfo='+ $12.49shipping', seller='Shaffer-Berry']]
